湖南迄今为止投资规模最大的台资项目8月将在岳阳投产,http://baijiahao.baidu.com/s?id=1639735987140479913,红网,发布时间：07-22 13:38,7月20日，岳阳城陵矶综保区打印机项目生产区厂房进入设备安装阶段，将于8月份试生产。该项目总建筑面积约59万平方米，工程总投资27.6亿元。项目投产后，预计将实现年产值100亿元。（记者 李璐 通讯员 李西 周波）仅7个月，一个面积相当于83个足球场大的项目拔地而起。7月20日，岳阳城陵矶综保区打印机项目生产区厂房进入设备安装阶段，将于8月份试生产。该项目是湖南迄今为止引进的投资规模最大的台资项目，也是近年来岳阳市最大的建设投资项目。项目总建筑面积约59万平方米，工程总投资27.6亿元。项目投产后，预计将实现年产值100亿元，货运量3万标箱，年进出口总额20亿美元，年创税费10亿元，吸纳就业1万人以上。项目最大难点在于工期紧，须在8个月内完成31万O的工业厂房工程。从去年12月进场到现在，项目团队在一片泥地上建立起1栋成型厂房、2栋组装厂房、2栋材料仓库、1个成品仓库及其他配套工程等10栋主体建筑，创造了投资方新金宝新建厂房的最快速度。日前，项目生产区厂房室外管网全部完成、管架连廊、外墙涂料、门窗及室内给排水系统、电气系统、防排烟系统安装及调试完成，项目“五脏六腑”和“外套”初步显现。“通过减少过程中很多的招标环节，大大缩短工期，项目只面对一个主体单位就是中建五局。”中建五局工程总承包管理中心总经理任长文表示。传统模式下，所有专业施工图必须经过图纸审查合格后，才可用于施工。而EPC（ Engineering Procurement Construction）工程总承包管理模式下，设计通过分阶段出图、分阶段图审，使得施工的插入时间大大提前，在整体项目施工周期不发生变化的情况下，大大缩短了项目整体建设时间。据项目生产区项目经理夏友亮介绍，项目采用的EPC模式，对工程建设项目的设计、采购、施工等环节实行全过程管理。项目管理组织机构实行“企业层级管理、总承包管理项目部、施工项目部”三级管理体系，实现了融合高效、协同联动的“作战”目的。通过层层分设技术质量部，项目紧抓项目技术质量管理工作。此外，企划管理部制定总进度计划、关键节点计划和关键路线三套计划，团队成员收集各方信息，实时更新汇报，制作施工工序导航图，不定期组织各方会议纠偏，确保工程按照计划实施。在保障项目质量的同时，大大缩短工期。
趣头条注册资本增加至1000万 增长566.67%,http://baijiahao.baidu.com/s?id=1639723010892071114,鞭牛士,发布时间：07-22 10:13,鞭牛士7月22日消息，天眼查数据显示，7月18日，趣头条运营主体上海基分文化传播有限公司发生工商变更，注册资本增加增加至1000万，增幅达566.67%。变更后趣头条创始人谭思亮为最大股东，持股44.55%。除此之外，李磊等5位董事退出，新增董事澎湃新闻副总经理黄武锋和陈思晖。
华夏银行选举王洪军、罗乾宜为副董事长,http://baijiahao.baidu.com/s?id=1639723301087128514,每日经济新闻,发布时间：07-22 10:18,每经记者：张卓青    每经编辑：徐豪图片来源：摄图网近日，华夏银行（600015.SZ）发布公告称，董事会审议并通过了《关于选举副董事长的议案》，该行选举王洪军、罗乾宜为副董事长，华夏银行表示目前两人的相关任职资格尚待银保监会核准。公开资料显示，王洪军出生于1969年3月，硕士研究生，高级会计师。曾任北京金隅集团有限责任公司副总会计师、总会计师；北京金隅股份有限公司财务资金部部长、财务总监、董事。现任首钢集团有限公司财务总监，值得注意的是，首钢集团有限公司是华夏银行的第一大股东，持有该行20.28%的股份。罗乾宜，1965年9月出生，博士研究生，高级会计师，享受国务院特殊津贴专家。曾任中国兵器工业总公司财务会计局副处长；中国燕兴总公司副总经理兼总会计师；中国兵器工业集团公司财会审计部主任；中国兵器工业集团公司总会计师兼任兵工财务有限责任公司副董事长；中国兵器工业集团公司总会计师兼任兵工财务有限责任公司董事长。现任国家电网有限公司总会计师、党组成员。《每日经济新闻》记者注意到，今年一季度华夏银行业绩增长较为平稳，该行在今年一季度共实现营收195.09亿元，同比增长了22.66%，归母净利润为46.04亿元，同比增长了1.21%。截至今年一季度末，该行的资产总额为2.79万亿元；不良贷款率为1.85%，与上年同期持平；拨备覆盖率为157.51%，同比下降1.08个百分点。
为给蔬菜水果防暑降温，新发地制冰厂24小时不停歇,http://baijiahao.baidu.com/s?id=1639735097847133049,北晚新视觉网,发布时间：07-22 13:22,"连日来高温闷热，为给蔬菜水果防暑降温,新发地的制冰厂开足了马力，24小时不停歇制冰，这几天每天都得制造100吨左右。新发地汇聚了全国各地的蔬菜水果，保障着北京市民的蔬菜供应。在高温天气里，如何给蔬菜水果防暑降温？相关负责人介绍，蔬菜商户们对碎冰的需求量非常大，商户会先将报纸铺在蔬菜上面，然后撒上碎冰碴来降温保鲜。水果降温保鲜主要靠冰袋，而海鲜生鲜商户则更需要冰块。相关负责人介绍，从5月开始北京新发地市场的制冰厂就进入了生产旺季，制冰量从每天十几吨不断攀升，尤其是进入7月份，随着高温天气持续，厂里的制冰机器昼夜不停地生产冰块，每天大约需要制冰100吨左右才能满足商户的各种需求。大的冰块有100斤重，小的有经过碎冰机制作的碎冰碴，还有分装好的冰袋。为了服务好商户，新发地市场还会给大批坚守一线的商户送去冰水和绿豆汤防暑降温。为了保证上市蔬菜的新鲜，北京新发地鼓励商户尽量在夜间交易，尤其是叶菜类商户，近期绝大部分已经转为了夜间交易。在新发地百舸湾公司，社区蔬菜直通车会在当天下午将土豆、洋葱、大葱等耐放的蔬菜采购整理好，当天半夜或凌晨才去采购新鲜的叶类菜，然后直接配送到社区，让绿油油的蔬菜最“鲜”抵达市民身边。记者了解到，高温目前未影响到蔬菜价格，近一周新发地的蔬菜价格呈下降趋势。据市场统计，7月19日新发地市场蔬菜的加权平均价是1.8元/公斤，比7月12日的2.1元/公斤下降了14.29%，比去年同期的1.84元/公斤下降了2.17%。相关负责人介绍，蔬菜价格持续下降的主要原因是目前北京的蔬菜主产区由南向北的转换基本完成，北方产区如张家口、辽宁、内蒙古、山西等地区的蔬菜都在陆续上市，市场蔬菜保有量的上升，抑制了价格的上涨。"
科创板开市，约9家公司涨超100%！一文了解股民关..,http://baijiahao.baidu.com/s?id=1639725607839559987,德林社,发布时间：07-22 10:56,文 | 杨万里千呼万唤始出来！7月22日，伴随着25家上市企业敲起的锣鼓声，科创板正式开市。与主板不同，科创板股票上市前五日不设涨跌幅限制，之后每日涨跌幅由主板的10%放宽至20%。截止上午10点，约9家公司涨超100%。其中，安集微电子、澜起科技上涨幅度超过200%。面对肩负使命的科创板，未参与科创板的小股民关心的是，科创板将如何影响市场？回顾历史，2009年，当创业板首批28家公司上市首日，平均涨幅为106.23%。其中，涨幅最高的是金亚科技，高达209.73％，而涨幅最小的南风股份也有75.84％。不过，在经历短期炒作后，市场逐渐回归理性。三个月后，首批创业板上市公司平均涨幅为-15.90%。如果在高点买入相关公司，甚至可能亏损超30%。周末内参提示到，在创业板开板之后的一个月左右时间里，上证指数上涨13.54%，深证成指涨15.61%，此后两大指数均走入8个月的震荡下跌熊途之中。形成反差的，在创业板开板的前后一年时间里，中小板指数则是走出连续的牛市行情，一年时间里上涨57.91%，创业板开板之时正是中小板牛市半山腰。复盘创业板，它对中小板风险偏好起到一定提振作用。而科创板对标股、科技概念短期受事件驱动或有上涨空间。科创板有个特点，即市盈率打破了23倍的新股发行隐性规则。科创板首发25家公司平均发行价为29.2元，平均市盈率为53.4倍。其中，中微公司以170.75倍市盈率占据榜首。（首批科创板发行价对应2018年PE）部分市场人士在热议，对于那些高市盈率公司，如何看待呢？上交所表示，科创企业因其科技含量、企业发展模式都与传统企业有所不同，因而投资者应脱离此前单一的“唯市盈率论”。分析科创板公司核心应看两点：首先看上市公司质量。本次上会的25家公司中，涉及计算机、通信和其它电子设备制造领域的公司有9家，涉及专用设备制造业的公司有8家。从研发投入数据看，15家公司研发投入在5000万元以上，其中7家研发投入超亿元。从申请专利看，中国通号、中微公司和光峰科技的专利数较多，分别有1421件、951件和792件，航天宏图、新光光电和瀚川智能的专利数相对较少，分别只有8件、11件和44件。其次，要关注上市公司的信息披露情况。与创业板不同的是，科创板实施的是注册制，上会条件比以往更严谨。目的是为了减少上市公司虚假信息披露情况发生以及筛选真正有价值的公司。数据显示，今年以来，监管层加强了对上市公司信息披露的管理，并且加快了劣质公司的退市，例如5月深交所就一次性发布了7家暂停上市公告。此外，科创板也推出了“保荐跟投”制度，更加突出了中介机构的责任。从科创板首批25家挂牌上市公司的保荐机构分布来看，中信建投5.5家，华泰联合3.5家，中信证券3家。对于那些尚未满足科创板开户门槛的小投资者也在担忧，科创板会产生分流效应，是这样吗？经尺度APP查询，从创业板开市后成交金额来说，开市当天28只创业板股票总成交金额为219亿元，成交额占沪深两市总成交金额的10.09%（当日两市总成交金额为2170.89亿元）。之后创业板市场成交额开始回落，此后半个月内，平均成交金额仅为39.6亿元。用创业板开市经验看，首日会对市场产生一定的分流效应，但在接下来的交易日中逐步消退。周末高层官员也表示，首批25家上市企业容量有限，如果按80%换手率来算大约会有300亿成交金额，与沪深主板相比资金额较小，不会产生较大冲击。值得关注的是，此前MSCI官网显示，将会在11月半年度指数评估前继续观察中国科创板，并提供进一步合格性评估。如果首批上市的科创板公司能纳入MSCI名单，这对资本市场无疑是一大利好。当然，在乐观之际也建议大家保持一份理性。回顾创业板的历史走势，当年那些爆炒的如金亚科技（停牌）、南风股份、华谊兄弟等上市公司，它们现在股价已经没有了高光时刻的盛况。真正的优质上市公司不是短期出现的，前期大幅炒作反而透支了未来的空间。上市后一些基本面质地不好的公司不排除破发的可能，这是大家要关注的。因此，尺度app接下来将着重关注科创板上市公司的基本面，用具体数据分析单家公司。
山东新开工这593个重大项目 青岛投资额最多,http://baijiahao.baidu.com/s?id=1639723304652132022,闪电新闻,发布时间：07-22 10:14,记者从山东省发改委获悉二季度全省共有593个重大项目开工建设总投资5196亿元其中，潍坊开工项目数量最多，达85个；青岛、菏泽、聊城分别开工63个项目，青岛开工项目投资额最多，达1530亿元。“这些项目陆续开工，将显著扩大有效投资，推动补齐重点领域短板，为全省新旧动能转换和高质量发展集聚能量。”省发改委相关处室负责人介绍，已开工重大项目加快推进，不断形成实物工作量，上半年，省级调度管理的2019年省重点项目及新旧动能转换两批优选项目共计完成投资1649亿元，有力支撑全省投资运行和结构调整。按照省委、省政府《关于“担当作为、狠抓落实”重点任务的实施方案》要求，现将《全省二季度新开工重大项目清单》公开发布。（来源：大众日报 ・ 新锐大众 记者 杜文景 通讯员 李宪泽）
科创板鸣锣开市，首批25家公司正式上市交易,http://baijiahao.baidu.com/s?id=1639723060464910582,河北新闻网,发布时间：07-22 10:16,去年11月5日，我国在首届中国国际进口博览会上郑重宣布，在上海证券交易所设立科创板，并试点注册制，短短259天之后科创板便成功上市交易，这是中国资本市场的一大奇迹。25家上市公司都是先进制造业企业。从行业分布来看，新一代信息技术类企业13家，新材料产业5家，高端装备制造产业5家，生物产业2家。首批科创板上市企业科技成色很足。25家上市公司2018年研发投入金额在营收中平均占比11.3%，远高于A股其他板块。其中15家企业去年研发投入在5000万元以上，7家去年研发投入超过亿元，中国通号研发投入高达13.8亿元。在25家企业中，有10家去年营业收入超过10亿元，占比为四成。在净利润方面，有13家企业去年归母净利润超过1亿元，占比超过半数。为适应科创的企业的特点，科创板设立了全新的制度和规则，新规则多达40余项，富有很大的包容性。来源：中国日报
微盟集团(2013.HK)：SaaS业务与智能营销..,http://baijiahao.baidu.com/s?id=1639723047253343201,格隆汇,发布时间：07-22 10:14,机构：东吴证券评级：增持公司为基于微信生态的中小企业服务第三方服务商，业务主要包括零售SAAS服务业务和精准营销服务。从经营层面来看，公司收入方面在SAAS业务和智能营销业务双拉动下，持续实现高速增长，其中2018年公司收入达到8.65亿元，同比增长62%，随着公司B端业务体量的增加，业务增长的潜力将逐步释放，预计未来三年内有望持续保持高速增长；公司业绩方面，亏损率有所收窄，亏损主要原因为营销成本过高，15/16/17/18年销售及分销开支与收益的比值分别为91.1%、107.0%、56.0%、52.0%，我们预期随着业务规模的增加销售费用占比下降将迎来盈利拐点。从主要业务业务指标来看，软件订阅业务付费商户数量从2015年的23859个增加到2018年的64695个，同时单商户的ARPU稳步增长，另外业务流失率逐渐下降，16/17/18年流失率分别为48.7%、27.2%、26.8%；精准营销业务，2018年广告主数量达28589个，增速为61.7%，ARPU为87185元，增速为65.2%，复投率为55.4%，提高4.8个百分点，公司业务结构逐步优化，合作中小企业商户稳步增长，留存率及广告复投率都有所提升。在业务层面，公司深耕中小企业服务市场：1、公司实施统一与定制化相结合的服务路线，SAAS产品提供统一的解决方案，PaaS平台提供定制化的服务；2、公司在底层系统的基础上，针对垂直领域提供不同的解决方案，建立起多场景、垂直化的商家服务生态；3、两块业务协同发展，打造一站式的服务体系；4、公司在基于腾讯流量基础，拓展其他平台流量体系，拓展流量渠道。自14年起由于SaaS业务在降低中小企业存储成本、功能快捷更新等方面的优势，行业迎来快速增长期，我们预计未来有望持续保持较高速增长；另外由于电商的逐步的去中心化，基于微信流量的第三方中小电商服务行业兴起规模持续扩大，公司依据自身产品及大数据积累等方面优势，逐步夯实龙头地位，未来基于腾讯流量体系，在去中心化的趋势下为B端赋能的潜力值得期待。盈利与投资评级：我们预计2019-2021年营业收入为13.03亿、18.01亿、23.15亿元，归母净利润分别为0.97亿、1.81亿、3.04亿元，对应当前股价PE分别为92、50、30X，看好公司发展前景，给予“增持”评级。风险提示：对于腾讯平台较为依赖的风险；产品开发及完善滞后市场发展的风险；渠道合作伙伴流失的风险。
科创板正式开市交易：首批25家公司登陆上海证券交易..,http://baijiahao.baidu.com/s?id=1639723117553060237,央视网新闻,发布时间：07-22 10:17,今天（7月22日），中国资本市场将迎来一件大事――科创板正式开市交易，首批25家公司将登陆上海证券交易所。首先来了解一下此次登陆上交所科创板企业的情况。今年6月18日晚间，上海证券交易所官网上一则极其简单的消息披露引发了许多人的关注：一家名叫华兴源创的公司，作为首批科创板申报企业正式注册生效，并随即拿到了代号为688001的股票代码，成为历史上第一只科创板股票。传统上我们上交所的股票以600开头的，所以688开头有个非常好的辨识，投资者一看这个代码就知道是科创板的股票。2019年7月22日，包括华兴源创在内，一共有25只以688开头的股票将正式进入上市交易环节，而它们与其他板块股票不同的远远不只是代码这么简单。我们传统的那些市场板块，比如说主板、中小板，还有创业板，在传统上是以企业的发展阶段或者是以企业的规模作为划分依据的。科创板首批上市25家企业中，有13家公司的行业属于新一代信息技术，占比52%，高端装备公司和新材料公司各5家，分别占比20%。此外，还有2家公司属于生物医学行业，占比8%。值得注意的是，从公开业绩上看，虽然大部分上市企业都在2019年上半年实现了净利润的同比增长，却有两家公司净利润下滑，一家处于亏损状态。重视成长性而非短期盈利，对各类成长型企业的包容，正是科创板有别于其他A股市场的一个显著特征。我们可能看不到他的利润，看不到他的收入，我们更多关注是什么？更多是看它的技术含量，有没有科创属性。
